{
  "schema_version": "greppy.hardware-evidence.v1",
  "created_utc": "2026-07-13T19:37:48Z",
  "platform": {
    "os": "macos",
    "os_version": "26.2",
    "arch": "arm64",
    "cpu_model": "Apple M5",
    "cpu_cores": 10,
    "ram_gb": 32,
    "apple_silicon_generation": "M5",
    "gpu": {
      "name": "Apple M5 GPU",
      "driver_version": "macOS 26.2",
      "vram_total_mib": 0,
      "compute_capability": null,
      "metal_family": "apple9+metal4"
    }
  },
  "product": {
    "version": "greppy 0.1.3",
    "source_sha": "8dc98f9a835ba9e8cddbfee342357ceb4f23fa74",
    "binary_sha256": "39e4fc82b6b55a8591ea08cd3db354d53c210ff15ba8b6907736c3394ffdd6b3",
    "backend_compiled": true,
    "backend_build_info": "embedded-metallib;metal4=yes;mul_mm=tensor"
  },
  "backend": {
    "requested": "metal",
    "selected": "metal",
    "selected_device": "metal:0000000100000455",
    "cpu_capabilities": [
      "dotprod",
      "i8mm",
      "neon"
    ],
    "baseline_x86_required": false,
    "cuda_toolkit_visible": null,
    "cuda_backend_needed_libs": null
  },
  "models": {
    "embedding": {
      "model_id": "google/embeddinggemma-300m@sha256:b469d441220e6327d89ed6109d31ed45f6d5e97ae76d35f159ae22a43cb4e4bf",
      "model_sha256": "53f7d1c0d5c84a81e46f3bea8e0f17c94f459ffbaa8b06f7f52f1f09e58996f2",
      "tokenizer_sha256": "6852f8d561078cc0cebe70ca03c5bfdd0d60a45f9d2e0e1e4cc05b68e9ec329e"
    },
    "summary": {
      "model_id": "greppy/qwen35-0.8b-function-purpose-mtp-q4km-2026-07-11",
      "model_sha256": "d09d5028e28ea9df501d83a9a60b80ed73f878b4b98424b09a39505364a1053f",
      "tokenizer_sha256": "5f9e4d4901a92b997e463c1f46055088b6cca5ca61a6522d1b9f64c4bb81cb42"
    }
  },
  "measurements": {
    "fixture": {
      "files": 2,
      "tree_sha256": "6530ced82d9d2cce225c7ec128a14505437fa1b2a66a1d537c487577e2f7e6e2"
    },
    "index_cold_ms": 3632,
    "semantic_search_ms": {
      "calls": 20,
      "p50_ms": 6896,
      "p95_ms": 10380,
      "min_ms": 4743,
      "max_ms": 11460
    },
    "brief_ms": {
      "calls": 20,
      "p50_ms": 2632,
      "p95_ms": 5624,
      "min_ms": 2202,
      "max_ms": 5734
    },
    "vram": null,
    "notes": [
      "Metal tensor-ops (Metal 4) matmul path exercised on this GPU generation (family: apple9+metal4)."
    ]
  },
  "checks": [
    {
      "name": "doctor selects requested backend (metal)",
      "pass": true,
      "detail": "selected=metal device=metal:0000000100000455"
    },
    {
      "name": "requested backend compiled into binary",
      "pass": true,
      "detail": "embedded-metallib;metal4=yes;mul_mm=tensor"
    },
    {
      "name": "doctor reports embedded model digests",
      "pass": true
    },
    {
      "name": "index completes on fixture",
      "pass": true,
      "detail": "3632ms"
    },
    {
      "name": "brief returns definition with summary",
      "pass": true
    },
    {
      "name": "semantic-search returns ranked hits",
      "pass": true
    },
    {
      "name": "expand resolves search evidence",
      "pass": true
    },
    {
      "name": "semantic-search ordering is deterministic across reruns",
      "pass": true
    },
    {
      "name": "grep passthrough byte-exact vs system grep",
      "pass": true
    }
  ],
  "status": "pass"
}
